{
  "calibration_profile_id": null,
  "content_hash": "sha256:003d99e4560859f38d76b3593255a2be2b6b2e3ea0e94497259c182a92e211ca",
  "measurement_lineage_id": "mlineage_7c6dc8e5a4646eba18c392cf793261b6b3df6ac6",
  "normalization_transform": {
    "code_digest": "sha256:4237b60322f9621bed6652194795eda9012dcf61f7f5568a1c44e861747b12c9",
    "code_revision": "flockoff-runtime-0.1.0",
    "name": "flock_you_json_normalizer",
    "version": "0.1.0"
  },
  "parent_lineage_ids": [],
  "pass_id": "north-south",
  "raw_capture_digest": "hmac-sha256:1bae504d849ce177a846bd6e02254bda31b28d4dc3cd21f508ab94b4c2123344",
  "receiver_id": "rx-a",
  "schema_version": "1.0.0",
  "session_id": "replay-session-1"
}
